{
  "$schema": "https://json-schema.org/draft/2020-12/schema",
  "type": "object",
  "additionalProperties": false,
  "required": [
    "task_id",
    "status",
    "objective",
    "state_transition",
    "files_changed",
    "commands",
    "evaluations",
    "expertise_coverage",
    "agents_used",
    "alternatives",
    "findings",
    "assumptions",
    "decisions",
    "risks",
    "gates",
    "proof_level",
    "artifacts",
    "rollback",
    "next_action"
  ],
  "properties": {
    "task_id": {
      "type": "string"
    },
    "status": {
      "enum": [
        "completed",
        "partial",
        "blocked",
        "failed_safe",
        "reverted"
      ]
    },
    "objective": {
      "type": "string"
    },
    "state_transition": {
      "type": "object",
      "required": [
        "from",
        "to",
        "reason"
      ],
      "properties": {
        "from": {
          "type": "string"
        },
        "to": {
          "type": "string"
        },
        "reason": {
          "type": "string"
        }
      },
      "additionalProperties": true
    },
    "files_changed": {
      "type": "array",
      "items": {
        "type": "string"
      }
    },
    "commands": {
      "type": "array",
      "items": {
        "type": "object",
        "required": [
          "command",
          "exit_code"
        ],
        "properties": {
          "command": {
            "type": "string"
          },
          "exit_code": {
            "type": "integer"
          },
          "artifact": {
            "type": [
              "string",
              "null"
            ]
          }
        },
        "additionalProperties": false
      }
    },
    "evaluations": {
      "type": "array",
      "items": {
        "type": "object"
      }
    },
    "expertise_coverage": {
      "type": "array",
      "items": {
        "type": "object",
        "required": [
          "domain",
          "state",
          "reason"
        ],
        "properties": {
          "domain": {
            "type": "string"
          },
          "state": {
            "enum": [
              "ACTIVE",
              "CONSULT",
              "NOT_APPLICABLE"
            ]
          },
          "reason": {
            "type": "string"
          }
        },
        "additionalProperties": false
      }
    },
    "agents_used": {
      "type": "array",
      "items": {
        "type": "string"
      }
    },
    "alternatives": {
      "type": "array",
      "items": {
        "type": "object"
      }
    },
    "findings": {
      "type": "array",
      "items": {
        "type": "object"
      }
    },
    "assumptions": {
      "type": "array",
      "items": {
        "type": "string"
      }
    },
    "decisions": {
      "type": "array",
      "items": {
        "type": "string"
      }
    },
    "risks": {
      "type": "array",
      "items": {
        "type": "string"
      }
    },
    "gates": {
      "type": "array",
      "items": {
        "type": "string"
      }
    },
    "proof_level": {
      "type": "integer",
      "minimum": 0,
      "maximum": 9
    },
    "artifacts": {
      "type": "array",
      "items": {
        "type": "object"
      }
    },
    "rollback": {
      "type": "string"
    },
    "next_action": {
      "type": "string"
    }
  }
}
