{
  "task_id": "BASELINE-001",
  "status": "completed",
  "objective": "Implement and independently evaluate a replaceable, point-in-time-safe synthetic framework comparing incumbent, seeded random, transparent-rule, recency, and simple statistical ranking policies on identical candidate, split, label, metric, and exact-ten-or-abstain contracts without claiming predictive validity or lift.",
  "state_transition": {
    "from": "BASELINE-001 in_progress; OUTCOMES-001 public proof level 5 checkpoint active",
    "to": "BASELINE-001 completed at public proof level 5; CALIBRATION-001 selected in_progress; ARCHITECTURE-001 and IDENTITY-001 remain executable",
    "reason": "The independent public evaluator reconstructs the frozen cohort, registry, fit, five policy families, exact run matrix, MATH problems and decisions, metrics, replacement rule, bindings, and receipt; 47 registered mutations are detected and three independent post-repair sweeps are clean."
  },
  "files_changed": [
    "artifacts/baselines/BASELINE-001-start.json",
    "artifacts/baselines/public_evaluator_contract.json",
    "artifacts/baselines/frozen_benchmark.json",
    "artifacts/baselines/policy_registry.json",
    "artifacts/baselines/canonical_run.json",
    "artifacts/baselines/capability_classification_reconciliation.json",
    "artifacts/evaluations/baseline_framework.json",
    "artifacts/evaluations/baseline_model_synthetic.json",
    "artifacts/models/model_registry.json",
    "artifacts/evaluations/autonomous_frontier_meta.json",
    "artifacts/context/current_task_packet.json",
    "artifacts/context/current_task_packet.md",
    "artifacts/task-results/BASELINE-001.json",
    "contracts/baseline_policy.schema.json",
    "contracts/baseline_evaluation.schema.json",
    "control/AUTONOMOUS_FRONTIER_CONTRACT.json",
    "control/GATES.json",
    "control/CURRENT_STATE.json",
    "control/CURRENT_TASK.json",
    "control/TASK_GRAPH.json",
    "tasks/BASELINE-001.json",
    "tasks/CALIBRATION-001.json",
    "src/cre_foundry/baselines/__init__.py",
    "src/cre_foundry/baselines/framework.py",
    "evals/public/baseline_framework_evaluator.py",
    "evals/public/test_baseline_framework.py",
    "scripts/compile_repository_task_context.py",
    "scripts/generate_baseline_artifacts.py",
    "scripts/validate_baseline_framework.py",
    "scripts/validate_baseline_models.py",
    "evals/known_bad/frontier/baseline_all_row_score_projection.json",
    "evals/known_bad/frontier/baseline_candidate_set_asymmetry.json",
    "evals/known_bad/frontier/baseline_complexity_tie_promoted.json",
    "evals/known_bad/frontier/baseline_coordinated_feature_rehash.json",
    "evals/known_bad/frontier/baseline_coordinated_registry_rehash.json",
    "evals/known_bad/frontier/baseline_duplicate_location.json",
    "evals/known_bad/frontier/baseline_duplicate_route_seed.json",
    "evals/known_bad/frontier/baseline_feature_clock_reordered.json",
    "evals/known_bad/frontier/baseline_feature_view_asymmetry.json",
    "evals/known_bad/frontier/baseline_forged_label_view.json",
    "evals/known_bad/frontier/baseline_forged_math_problem_hash.json",
    "evals/known_bad/frontier/baseline_future_feature.json",
    "evals/known_bad/frontier/baseline_future_label_asof.json",
    "evals/known_bad/frontier/baseline_future_recency_value.json",
    "evals/known_bad/frontier/baseline_immature_as_negative.json",
    "evals/known_bad/frontier/baseline_issue_nine.json",
    "evals/known_bad/frontier/baseline_label_denominator_asymmetry.json",
    "evals/known_bad/frontier/baseline_math_input_contamination.json",
    "evals/known_bad/frontier/baseline_metric_wrong_denominator.json",
    "evals/known_bad/frontier/baseline_missing_required_policy.json",
    "evals/known_bad/frontier/baseline_nondeterministic_random.json",
    "evals/known_bad/frontier/baseline_outcome_feature.json",
    "evals/known_bad/frontier/baseline_outcome_source_family.json",
    "evals/known_bad/frontier/baseline_partial_labels_finalized.json",
    "evals/known_bad/frontier/baseline_policy_direct_selection.json",
    "evals/known_bad/frontier/baseline_production_promotion.json",
    "evals/known_bad/frontier/baseline_protected_selected.json",
    "evals/known_bad/frontier/baseline_receipt_only.json",
    "evals/known_bad/frontier/baseline_rehashed_future_feature.json",
    "evals/known_bad/frontier/baseline_rehashed_metrics.json",
    "evals/known_bad/frontier/baseline_rehashed_null_label.json",
    "evals/known_bad/frontier/baseline_rehashed_policy_score.json",
    "evals/known_bad/frontier/baseline_rehashed_random.json",
    "evals/known_bad/frontier/baseline_rehashed_receipt.json",
    "evals/known_bad/frontier/baseline_rehashed_split.json",
    "evals/known_bad/frontier/baseline_rehashed_universe.json",
    "evals/known_bad/frontier/baseline_replacement_with_more_abstention.json",
    "evals/known_bad/frontier/baseline_seed_cherrypick.json",
    "evals/known_bad/frontier/baseline_split_overlap.json",
    "evals/known_bad/frontier/baseline_split_temporal_order.json",
    "evals/known_bad/frontier/baseline_stat_fraction_rounded.json",
    "evals/known_bad/frontier/baseline_stat_null_label.json",
    "evals/known_bad/frontier/baseline_synthetic_as_predictive.json",
    "evals/known_bad/frontier/baseline_test_label_in_fit.json",
    "evals/known_bad/frontier/baseline_test_reuse.json",
    "evals/known_bad/frontier/baseline_unseeded_random.json",
    "evals/known_bad/frontier/baseline_winner_below_margin.json",
    "evals/known_bad/frontier/model_future_feature.json",
    "evals/known_bad/frontier/model_missing_baselines.json"
  ],
  "commands": [
    {"command": "uv run --python 3.12 python scripts/validate_baseline_framework.py", "exit_code": 0, "artifact": "artifacts/evaluations/baseline_framework.json"},
    {"command": "uv run --python 3.12 python -m unittest evals.public.test_baseline_framework", "exit_code": 0, "artifact": "artifacts/evaluations/baseline_framework.json"},
    {"command": "uv run --python 3.12 python -m unittest discover -s evals/public -p 'test_*.py'", "exit_code": 0, "artifact": "artifacts/evaluations/baseline_framework.json"},
    {"command": "uv run --python 3.12 python scripts/validate_control_plane.py", "exit_code": 0, "artifact": "control/CURRENT_STATE.json"},
    {"command": "uv run --python 3.12 python scripts/validate_frontier_meta.py", "exit_code": 0, "artifact": "artifacts/evaluations/autonomous_frontier_meta.json"},
    {"command": "evaluate AF-BASELINE-MODEL-001 through scripts/evaluate_autonomous_frontier.py", "exit_code": 0, "artifact": "artifacts/evaluations/baseline_model_synthetic.json"},
    {"command": "uv run --python 3.12 python scripts/evaluate_autonomous_frontier.py --report artifacts/evaluations/autonomous_frontier_report.json", "exit_code": 1, "artifact": "artifacts/evaluations/autonomous_frontier_report.json"}
  ],
  "evaluations": [
    {"evaluator_id": "baseline-framework-public-v1", "result": "PASS", "route_days": 8, "candidate_rows": 96, "policy_families": 5, "registered_random_seeds": 16, "policy_route_runs": 160, "registered_mutations_detected": 47, "registered_mutations_total": 47, "focused_public_tests": 21, "full_public_suite_tests": 91},
    {"evaluator_id": "independent-evaluator-design-sweep", "result": "PASS_AFTER_REPAIR", "repairs_verified": ["evaluator-owned MATH oracle", "exact run-key matrix", "complete MATH score projection", "all binding and receipt reconstruction", "rehashed semantic attacks", "route-day macro versus micro recall"]},
    {"evaluator_id": "independent-proof-and-metric-sweep", "result": "PASS_AFTER_REPAIR", "repairs_verified": ["seed-normalized route-day metrics", "nullable incomplete TEST behavior", "full replacement guardrails and complexity order", "explicit human replacement gate", "frontier compatibility artifacts"]},
    {"evaluator_id": "independent-temporal-state-sweep", "result": "PASS_AFTER_REPAIR", "repairs_verified": ["frozen cohort and registry", "split and label chronology", "feature ancestry and recency binding", "Cartesian completeness", "exact non-score MATH symmetry"]},
    {"evaluator_id": "AF-BASELINE-MODEL-001", "result": "FAIL", "base_result": "BLOCKED_EXTERNAL", "base_errors": 0, "interpretation": "Every autonomous PL5 prerequisite passes; the resolved gate remains FAIL because AF-MATH-STATS-001 and AF-OUTCOMES-LABELS-001 dependencies fail, while real historical comparison remains behind GATE-OUTCOME-LABELS-MATURITY-001."},
    {"evaluator_id": "autonomous-frontier", "result": "FAIL", "failed_gates": 23, "interpretation": "Positive-value autonomous work remains in CALIBRATION-001, ARCHITECTURE-001, and IDENTITY-001; the global frontier is not terminal."}
  ],
  "expertise_coverage": [
    {"domain": "statistical_learning", "state": "ACTIVE", "reason": "Specified five replaceable policies including exact train-only beta-binomial bucket rates."},
    {"domain": "causal_inference", "state": "ACTIVE", "reason": "Kept synthetic selected-list associations distinct from route-day ITT and incremental lift."},
    {"domain": "temporal_validation", "state": "ACTIVE", "reason": "Enforced feature, fit, split, prediction-freeze, label-availability, embargo, and evaluation-as-of clocks."},
    {"domain": "ranking_systems", "state": "ACTIVE", "reason": "Mapped pure exact scores through the frozen MATH exact-ten-or-abstain oracle."},
    {"domain": "testing_verification", "state": "ACTIVE", "reason": "Implemented independent reconstruction, 47 exact mutations, bounded properties, and three independent sweeps."}
  ],
  "agents_used": ["/root/outcomes_evaluator_design", "/root/outcomes_proof_review", "/root/outcomes_state_model"],
  "alternatives": [
    {"alternative": "Use the canonical OUTCOMES route-day as the baseline sample", "decision": "rejected", "reason": "It contains ten already-selected stops, incomplete maturity, and no counterfactual labels for unselected candidates."},